{
  "artifactKind": "compare-report",
  "comparabilityCoherence": {
    "benchmarkPolicyPath": "config/benchmark-methodology-thresholds.json",
    "checkedWorkloadCount": 1,
    "comparableWorkloadCount": 0,
    "failureCount": 0,
    "failures": [],
    "finalComparisonStatus": "diagnostic",
    "minTimedSamples": 7,
    "optionalComparableObligations": [
      "baseline_comparison_submit_scope_match"
    ],
    "requiredComparableObligations": [
      "workload_marked_comparable",
      "left_samples_present",
      "right_samples_present",
      "baseline_comparison_timing_phase_match",
      "baseline_comparison_execution_shape_match",
      "baseline_comparison_hardware_path_match"
    ],
    "smokeMinTimedSamples": 3,
    "status": "pass",
    "statusBeforeCoherence": "diagnostic"
  },
  "comparabilityFailures": [
    {
      "reasons": [
        "baseline timing class is process-wall, required operation",
        "comparison timing class is process-wall, required operation"
      ],
      "workloadId": "apple_metal_node_ort_webgpu_provider_compare_gemma3_270m_prefill_64tok_decode_64tok"
    }
  ],
  "comparabilityPolicy": {
    "mode": "strict",
    "requireTimingClass": "operation"
  },
  "comparabilitySummary": {
    "nonComparableCount": 1,
    "workloadCount": 1
  },
  "comparisonStatus": "diagnostic",
  "deltaPercentConvention": "positive_means_baseline_faster_percent_of_comparison_time_saved",
  "deltaPercentFormula": "((comparisonMs - baselineMs) / comparisonMs) * 100",
  "generatedAt": "2026-07-05T16:52:03.604761+00:00",
  "outPath": "bench/out/apple-metal-ort-node/20260705T163736Z/gemma270m.compare.json",
  "overall": {
    "baselineStatsMs": {
      "count": 0,
      "maxMs": 0.0,
      "meanMs": 0.0,
      "minMs": 0.0,
      "p10Ms": 0.0,
      "p50Ms": 0.0,
      "p95Ms": 0.0,
      "p99Ms": 0.0,
      "stdevMs": 0.0
    },
    "comparisonStatsMs": {
      "count": 0,
      "maxMs": 0.0,
      "meanMs": 0.0,
      "minMs": 0.0,
      "p10Ms": 0.0,
      "p50Ms": 0.0,
      "p95Ms": 0.0,
      "p99Ms": 0.0,
      "stdevMs": 0.0
    },
    "deltaPercent": {
      "meanPercent": 0.0,
      "p10Percent": 0.0,
      "p50Percent": 0.0,
      "p95Percent": 0.0,
      "p99Percent": 0.0
    }
  },
  "overallWorkloadUnitWall": {
    "baselineStatsMs": {
      "count": 0,
      "maxMs": 0.0,
      "meanMs": 0.0,
      "minMs": 0.0,
      "p10Ms": 0.0,
      "p50Ms": 0.0,
      "p95Ms": 0.0,
      "p99Ms": 0.0,
      "stdevMs": 0.0
    },
    "comparisonStatsMs": {
      "count": 0,
      "maxMs": 0.0,
      "meanMs": 0.0,
      "minMs": 0.0,
      "p10Ms": 0.0,
      "p50Ms": 0.0,
      "p95Ms": 0.0,
      "p99Ms": 0.0,
      "stdevMs": 0.0
    },
    "deltaPercent": {
      "meanPercent": 0.0,
      "p10Percent": 0.0,
      "p50Percent": 0.0,
      "p95Percent": 0.0,
      "p99Percent": 0.0
    }
  },
  "participants": {
    "left": {
      "executorId": "tjs_ort_node_doe",
      "hostIdentity": {
        "adapter": {
          "architecture": "M3",
          "description": "Apple M3",
          "device": "Apple M3",
          "vendor": "Apple"
        },
        "api": "webgpu",
        "arch": "arm64",
        "driver": "1.0.0",
        "hostname": "mac.lan",
        "kernel": "25.3.0",
        "os": "darwin"
      },
      "product": "tjs_ort_node_doe",
      "runtimeIdentity": {
        "binaryPath": "/Users/xyz/.nvm/versions/node/v22.20.0/bin/node",
        "binarySha256": "49161ba4e67afda85c25b2daa1f0e91d1bffc023d2dbc4886eda7a9ba38bca62",
        "executionBackend": "tjs_ort_node_webgpu",
        "packageLockHash": "e2c809d83657e7f6628e7b9ff904d84058c7db9cca55bcc29d05ed27b16b9b01",
        "packageName": "doe-gpu",
        "packageVersion": "0.4.7",
        "providerId": "doe",
        "providerName": "doe-gpu",
        "runtimeHost": "node"
      }
    },
    "right": {
      "executorId": "tjs_ort_node_webgpu_package",
      "hostIdentity": {
        "adapter": {
          "architecture": "metal-3",
          "description": "Metal driver on macOS Version 26.3 (Build 25D125)",
          "device": "apple-m3",
          "vendor": "apple"
        },
        "api": "webgpu",
        "arch": "arm64",
        "driver": "1.0.0",
        "hostname": "mac.lan",
        "kernel": "25.3.0",
        "os": "darwin"
      },
      "product": "tjs_ort_node_webgpu_package",
      "runtimeIdentity": {
        "binaryPath": "/Users/xyz/.nvm/versions/node/v22.20.0/bin/node",
        "binarySha256": "49161ba4e67afda85c25b2daa1f0e91d1bffc023d2dbc4886eda7a9ba38bca62",
        "executionBackend": "tjs_ort_node_webgpu_package",
        "packageLockHash": "",
        "packageName": "node-webgpu",
        "packageVersion": "",
        "providerId": "node-webgpu",
        "providerName": "node-webgpu",
        "runtimeHost": "node"
      }
    }
  },
  "primaryMetric": "measured_ms",
  "runReceiptPaths": [
    "bench/out/apple-metal-ort-node/20260705T165013Z/gemma270m.workspace/run-artifacts/tjs_ort_node_doe/tjs_ort_node_doe-apple_metal_node_ort_webgpu_provider_compare_gemma3_270m_prefill_64tok_decode_64tok-20260705T165013Z.run.json",
    "bench/out/apple-metal-ort-node/20260705T165108Z/gemma270m.workspace/run-artifacts/tjs_ort_node_webgpu_package/tjs_ort_node_webgpu_package-apple_metal_node_ort_webgpu_provider_compare_gemma3_270m_prefill_64tok_decode_64tok-20260705T165108Z.run.json"
  ],
  "schemaVersion": 1,
  "workloadManifest": {
    "freshnessReason": "standalone manifest; no backend workload catalog freshness check applies",
    "inputFreshness": "unknown",
    "ownership": "standalone",
    "path": "bench/workloads/workloads.node.ort-webgpu-provider-compare.apple-metal.json",
    "sha256": "91fc0a69a31975154bd2a09b3628cc235b779bf64948d7748743409199bb241c"
  },
  "workloads": [
    {
      "baselineStatsMs": {
        "count": 7,
        "maxMs": 8728.665833000001,
        "meanMs": 6003.423386857144,
        "minMs": 4920.665208,
        "p10Ms": 4920.665208,
        "p50Ms": 5144.031625,
        "p95Ms": 7410.920959,
        "p99Ms": 7410.920959,
        "stdevMs": 1372.9744749135234
      },
      "benchmarkClass": "comparable",
      "claimEligible": true,
      "comparability": {
        "advisoryFailedObligations": [],
        "baselineCommandRepeat": 1,
        "baselineExecutionErrorSampleCount": 0,
        "baselineExecutionShapes": [
          {
            "executionDispatchCount": 42304,
            "executionRowCount": 1,
            "executionSubmitCount": -1,
            "executionSuccessCount": 1
          }
        ],
        "baselineNormalizedExecutionShapes": [
          {
            "executionDispatchCount": 42304,
            "executionRowCount": 1,
            "executionSubmitCount": -1,
            "executionSuccessCount": 1
          }
        ],
        "baselineQueueSyncModes": [],
        "baselineResourceProbeAvailableCount": 0,
        "baselineResourceSampleMedian": 55,
        "baselineResourceSamplingTruncatedCount": 0,
        "baselineTimingClass": "process-wall",
        "baselineTimingSelectionPolicies": [
          "forced-process-wall"
        ],
        "baselineTimingSources": [
          "wall-time"
        ],
        "baselineTraceMetaSources": [
          "wall-time"
        ],
        "blockingFailedObligations": [
          "left_required_timing_class",
          "right_required_timing_class"
        ],
        "comparable": false,
        "comparisonCommandRepeat": 1,
        "comparisonExecutionErrorSampleCount": 0,
        "comparisonExecutionShapes": [
          {
            "executionDispatchCount": 42304,
            "executionRowCount": 1,
            "executionSubmitCount": -1,
            "executionSuccessCount": 1
          }
        ],
        "comparisonNormalizedExecutionShapes": [
          {
            "executionDispatchCount": 42304,
            "executionRowCount": 1,
            "executionSubmitCount": -1,
            "executionSuccessCount": 1
          }
        ],
        "comparisonQueueSyncModes": [],
        "comparisonResourceProbeAvailableCount": 0,
        "comparisonResourceSampleMedian": 52,
        "comparisonResourceSamplingTruncatedCount": 0,
        "comparisonTimingClass": "process-wall",
        "comparisonTimingSelectionPolicies": [
          "forced-process-wall"
        ],
        "comparisonTimingSources": [
          "wall-time"
        ],
        "comparisonTraceMetaSources": [
          "wall-time"
        ],
        "obligationSchemaVersion": 2,
        "obligations": [
          {
            "applicable": true,
            "blocking": true,
            "details": {
              "workloadComparable": true
            },
            "id": "workload_marked_comparable",
            "passes": true
          },
          {
            "applicable": true,
            "blocking": true,
            "details": {
              "baselineSampleCount": 7
            },
            "id": "left_samples_present",
            "passes": true
          },
          {
            "applicable": true,
            "blocking": true,
            "details": {
              "comparisonSampleCount": 7
            },
            "id": "right_samples_present",
            "passes": true
          },
          {
            "applicable": true,
            "blocking": true,
            "details": {
              "baselineTimingClasses": [
                "process-wall"
              ]
            },
            "id": "left_single_timing_class",
            "passes": true
          },
          {
            "applicable": true,
            "blocking": true,
            "details": {
              "comparisonTimingClasses": [
                "process-wall"
              ]
            },
            "id": "right_single_timing_class",
            "passes": true
          },
          {
            "applicable": true,
            "blocking": true,
            "details": {
              "baselineTimingClass": "process-wall",